Sequence ID,Description,Query ID,Target ID,Coverage,Percent Identity,Length,Mismatch,Gap Open,Query Start,Query End,Target Start,Target End,Strandedness,E-Value,Bit Score,Classification
AB124810.1_5,"AB124810.1_5 Paulownia witches'-broom phytoplasma groES, groEL, amp, nadE genes for molecular chaperonin GroES, molecular chaperonin GroEL, antigenic membrane protein, NAD synthase, partial and complete cds, strain: PaWB",AB124810.1_5,b27105 KJ940013 Candidatus Phytoplasma asteris Linum usitatissimum phytoplasma SF1,15,100.000,552,0,0,740,1291,1,552,plus,0.0,996,Phytoplasma sequence (+ strand)
AB738737.1_3,"AB738737.1_3 Hydrangea phyllody phytoplasma groES, groEL, amp, nadE genes for molecular chaperonin small subunit GroES, molecular chaperonin large subunit GroEL, antigenic membrane protein Amp, NAD synthase NadE, partial and complete cds, strain: HP",AB738737.1_3,b27105 KJ940013 Candidatus Phytoplasma asteris Linum usitatissimum phytoplasma SF1,15,99.638,552,2,0,672,1223,1,552,plus,0.0,987,Phytoplasma sequence (+ strand)
KF430807.1_1,"KF430807.1_1 'Brassica napus' phytoplasma clone Brassica 8-3 GroEL gene, complete cds",KF430807.1_1,b27105 KJ940013 Candidatus Phytoplasma asteris Linum usitatissimum phytoplasma SF1,34,100.000,552,0,0,271,822,1,552,plus,0.0,996,Phytoplasma sequence (+ strand)
AB124811.1_4,"AB124811.1_4 Phytoplasma sp. AYBG groES, groEL, amp, nadE genes for molecular chaperonin GroES, molecular chaperonin GroEL, antigenic membrane protein, NAD synthase, partial and complete cds",AB124811.1_4,b27105 KJ940013 Candidatus Phytoplasma asteris Linum usitatissimum phytoplasma SF1,15,100.000,552,0,0,694,1245,1,552,plus,0.0,996,Phytoplasma sequence (+ strand)
AB738741.1_2,"AB738741.1_2 Rhus yellows phytoplasma groES, groEL, amp, nadE genes for molecular chaperonin small subunit GroES, molecular chaperonin large subunit GroEL, antigenic membrane protein Amp, NAD synthase NadE, partial and complete cds, strain: RhY",AB738741.1_2,b27105 KJ940013 Candidatus Phytoplasma asteris Linum usitatissimum phytoplasma SF1,15,99.638,552,2,0,669,1220,1,552,plus,0.0,987,Phytoplasma sequence (+ strand)
